src/app/model_data.json

{
  "model": {
    "const": -2.5971,
    "sst_anomaly": 0.2104,
    "salinity": 2.1191,
    "po4": -1.6533,
    "fe": 0.4811,
    "uo": 1.5275,
    "vo": 0.3909
  },
  "feature_stats": {
    "sst_anomaly": {
      "min": -0.190291,
      "max": 0.818058,
      "mean": 0.258683,
      "std": 0.200569,
      "unit": "°C"
    },
    "salinity": {
      "min": 35.149151,
      "max": 36.445522,
      "mean": 36.082764,
      "std": 0.264539,
      "unit": "psu"
    },
    "po4": {
      "min": 0.641761,
      "max": 0.694784,
      "mean": 0.662876,
      "std": 0.012925,
      "unit": "mmol/m³"
    },
    "fe": {
      "min": 0.001026,
      "max": 0.001207,
      "mean": 0.001099,
      "std": 4.4e-05,
      "unit": "mmol/m³"
    },
    "uo": {
      "min": -0.216033,
      "max": 0.1106,
      "mean": -0.087011,
      "std": 0.057411,
      "unit": "m/s"
    },
    "vo": {
      "min": -0.081166,
      "max": 0.159142,
      "mean": 0.062389,
      "std": 0.03536,
      "unit": "m/s"
    }
  },
  "thresholds": {
    "p50": 0.3,
    "p80": 0.6
  },
  "metrics": {
    "r2": 0.901,
    "r2_adj": 0.3902,
    "n_obs": 529,
    "mae_modelo": -161.58,
    "mejora_pct": 21.6,
    "f_stat": 6.699e-42
  },
  "playas": {
    "Punta Cana": {
      "lat": 18.58,
      "lon": -68.37,
      "po4": 0.694784,
      "uo": -0.02335,
      "sst_anomaly": 0.5666,
      "salinity": 36.082764,
      "fe": 0.001099,
      "vo": 0.062389
    },
    "Bavaro Beach": {
      "lat": 18.71,
      "lon": -68.45,
      "po4": 0.694784,
      "uo": -0.01226,
      "sst_anomaly": 0.6607,
      "salinity": 36.082764,
      "fe": 0.001099,
      "vo": 0.062389
    },
    "Macao": {
      "lat": 18.79,
      "lon": -68.57,
      "po4": 0.694784,
      "uo": -0.0219,
      "sst_anomaly": 0.6996,
      "salinity": 36.082764,
      "fe": 0.001099,
      "vo": 0.062389
    },
    "Uvero Alto": {
      "lat": 18.82,
      "lon": -68.6,
      "po4": 0.694784,
      "uo": -0.0219,
      "sst_anomaly": 0.6996,
      "salinity": 36.082764,
      "fe": 0.001099,
      "vo": 0.062389
    },
    "Juanillo": {
      "lat": 18.48,
      "lon": -68.39,
      "po4": 0.694784,
      "uo": -0.02335,
      "sst_anomaly": 0.5666,
      "salinity": 36.082764,
      "fe": 0.001099,
      "vo": 0.062389
    },
    "Bayahibe": {
      "lat": 18.37,
      "lon": -68.84,
      "po4": 0.694784,
      "uo": -0.00407,
      "sst_anomaly": 0.8159,
      "salinity": 36.082764,
      "fe": 0.001099,
      "vo": 0.062389
    },
    "Dominicus": {
      "lat": 18.35,
      "lon": -68.83,
      "po4": 0.694784,
      "uo": -0.00407,
      "sst_anomaly": 0.8159,
      "salinity": 36.082764,
      "fe": 0.001099,
      "vo": 0.062389
    },
    "Isla Saona": {
      "lat": 18.15,
      "lon": -68.68,
      "po4": 0.694784,
      "uo": -0.02729,
      "sst_anomaly": 0.6089,
      "salinity": 36.082764,
      "fe": 0.001099,
      "vo": 0.062389
    },
    "La Romana (Minitas)": {
      "lat": 18.41,
      "lon": -68.97,
      "po4": 0.694784,
      "uo": -0.03909,
      "sst_anomaly": 0.7814,
      "salinity": 36.082764,
      "fe": 0.001099,
      "vo": 0.062389
    },
    "Caleta": {
      "lat": 18.44,
      "lon": -69,
      "po4": 0.694784,
      "uo": -0.03909,
      "sst_anomaly": 0.7814,
      "salinity": 36.082764,
      "fe": 0.001099,
      "vo": 0.062389
    },
    "Juan Dolio": {
      "lat": 18.42,
      "lon": -69.42,
      "po4": 0.694784,
      "uo": 0.01987,
      "sst_anomaly": 0.7526,
      "salinity": 36.082764,
      "fe": 0.001099,
      "vo": 0.062389
    },
    "Guayacanes": {
      "lat": 18.45,
      "lon": -69.43,
      "po4": 0.694784,
      "uo": 0.01987,
      "sst_anomaly": 0.7526,
      "salinity": 36.082764,
      "fe": 0.001099,
      "vo": 0.062389
    },
    "Boca Chica": {
      "lat": 18.45,
      "lon": -69.61,
      "po4": 0.694784,
      "uo": 0.0189,
      "sst_anomaly": 0.7117,
      "salinity": 36.082764,
      "fe": 0.001099,
      "vo": 0.062389
    },
    "Playa Rincon (Samana)": {
      "lat": 19.302,
      "lon": -69.231,
      "po4": 0.694784,
      "uo": -0.065,
      "sst_anomaly": 0.7,
      "salinity": 36.082764,
      "fe": 0.001099,
      "vo": 0.062389
    },
    "Playa Las Terrenas (Samana)": {
      "lat": 19.315,
      "lon": -69.54,
      "po4": 0.694784,
      "uo": -0.06,
      "sst_anomaly": 0.71,
      "salinity": 36.082764,
      "fe": 0.001099,
      "vo": 0.062389
    },
    "Playa Coson (Samana)": {
      "lat": 19.333,
      "lon": -69.622,
      "po4": 0.694784,
      "uo": -0.06,
      "sst_anomaly": 0.71,
      "salinity": 36.082764,
      "fe": 0.001099,
      "vo": 0.062389
    },
    "Playa Caleton (M.T.S.)": {
      "lat": 19.627,
      "lon": -70.073,
      "po4": 0.694784,
      "uo": -0.07,
      "sst_anomaly": 0.68,
      "salinity": 36.082764,
      "fe": 0.001099,
      "vo": 0.062389
    },
    "Playa Cabarete (P. Plata)": {
      "lat": 19.762,
      "lon": -70.408,
      "po4": 0.694784,
      "uo": -0.085,
      "sst_anomaly": 0.65,
      "salinity": 36.082764,
      "fe": 0.001099,
      "vo": 0.062389
    },
    "Playa Sosua (P. Plata)": {
      "lat": 19.758,
      "lon": -70.524,
      "po4": 0.694784,
      "uo": -0.085,
      "sst_anomaly": 0.65,
      "salinity": 36.082764,
      "fe": 0.001099,
      "vo": 0.062389
    },
    "Playa Dorada (P. Plata)": {
      "lat": 19.764,
      "lon": -70.723,
      "po4": 0.694784,
      "uo": -0.09,
      "sst_anomaly": 0.64,
      "salinity": 36.082764,
      "fe": 0.001099,
      "vo": 0.062389
    }
  },
  "historical": [
    {
      "time": "2023-11-01",
      "po4": 0.694784,
      "uo": -0.10632546246051788,
      "sst_anomaly": 0.8990994691848755,
      "nfai_pred": -0.48902150988578796,
      "nfai": null,
      "salinity": 36.082764,
      "fe": 0.001099,
      "vo": 0.062389,
      "prob_pred": 0.0014704872600918,
      "bloom_event": null
    },
    {
      "time": "2023-12-01",
      "po4": 0.694784,
      "uo": -0.13331948220729828,
      "sst_anomaly": 0.6335008144378662,
      "nfai_pred": -0.5053238868713379,
      "nfai": null,
      "salinity": 36.082764,
      "fe": 0.001099,
      "vo": 0.062389,
      "prob_pred": 0.0005431831420689727,
      "bloom_event": null
    },
    {
      "time": "2024-01-01",
      "po4": 0.694784,
      "uo": -0.09103626757860184,
      "sst_anomaly": 0.8417893052101135,
      "nfai_pred": -0.4876214861869812,
      "nfai": null,
      "salinity": 36.082764,
      "fe": 0.001099,
      "vo": 0.062389,
      "prob_pred": 0.002078519529323064,
      "bloom_event": null
    },
    {
      "time": "2024-02-01",
      "po4": 0.694784,
      "uo": -0.07419067621231079,
      "sst_anomaly": 0.6272426843643188,
      "nfai_pred": -0.49473652243614197,
      "nfai": null,
      "salinity": 36.082764,
      "fe": 0.001099,
      "vo": 0.062389,
      "prob_pred": 0.0025967851187565145,
      "bloom_event": null
    },
    {
      "time": "2024-03-01",
      "po4": 0.694784,
      "uo": -0.07546886056661606,
      "sst_anomaly": 0.7471672892570496,
      "nfai_pred": -0.47991716861724854,
      "nfai": null,
      "salinity": 36.082764,
      "fe": 0.001099,
      "vo": 0.062389,
      "prob_pred": 0.002845729516832211,
      "bloom_event": null
    },
    {
      "time": "2024-04-01",
      "po4": 0.694784,
      "uo": -0.147006556391716,
      "sst_anomaly": 0.8379281759262085,
      "nfai_pred": -0.48934632539749146,
      "nfai": null,
      "salinity": 36.082764,
      "fe": 0.001099,
      "vo": 0.062389,
      "prob_pred": 0.00046769005010895826,
      "bloom_event": null
    },
    {
      "time": "2024-05-01",
      "po4": 0.694784,
      "uo": -0.1235823929309845,
      "sst_anomaly": 1.0232025384902954,
      "nfai_pred": -0.4773459732532501,
      "nfai": null,
      "salinity": 36.082764,
      "fe": 0.001099,
      "vo": 0.062389,
      "prob_pred": 0.001058705972679464,
      "bloom_event": null
    },
    {
      "time": "2024-06-01",
      "po4": 0.694784,
      "uo": -0.12343424558639526,
      "sst_anomaly": 1.197464942932129,
      "nfai_pred": -0.47426480054855347,
      "nfai": null,
      "salinity": 36.082764,
      "fe": 0.001099,
      "vo": 0.062389,
      "prob_pred": 0.0012758028553244325,
      "bloom_event": null
    },
    {
      "time": "2024-07-01",
      "po4": 0.694784,
      "uo": -0.13213279843330383,
      "sst_anomaly": 0.9880310297012329,
      "nfai_pred": -0.4868156611919403,
      "nfai": null,
      "salinity": 36.082764,
      "fe": 0.001099,
      "vo": 0.062389,
      "prob_pred": 0.0008129403142377572,
      "bloom_event": null
    },
    {
      "time": "2024-08-01",
      "po4": 0.694784,
      "uo": -0.10125429183244705,
      "sst_anomaly": 0.9049057960510254,
      "nfai_pred": -0.4815376102924347,
      "nfai": null,
      "salinity": 36.082764,
      "fe": 0.001099,
      "vo": 0.062389,
      "prob_pred": 0.0016928062635956647,
      "bloom_event": null
    },
    {
      "time": "2024-09-01",
      "po4": 0.694784,
      "uo": -0.0680566281080246,
      "sst_anomaly": 0.8990599513053894,
      "nfai_pred": -0.4824438691139221,
      "nfai": null,
      "salinity": 36.082764,
      "fe": 0.001099,
      "vo": 0.062389,
      "prob_pred": 0.004059872979751579,
      "bloom_event": null
    },
    {
      "time": "2024-10-01",
      "po4": 0.694784,
      "uo": -0.05649884045124054,
      "sst_anomaly": 1.36030912399292,
      "nfai_pred": -0.4583653211593628,
      "nfai": null,
      "salinity": 36.082764,
      "fe": 0.001099,
      "vo": 0.062389,
      "prob_pred": 0.008914101177165727,
      "bloom_event": null
    },
    {
      "time": "2024-11-01",
      "po4": 0.694784,
      "uo": -0.06756319850683212,
      "sst_anomaly": 0.9576845169067383,
      "nfai_pred": -0.4796854555606842,
      "nfai": null,
      "salinity": 36.082764,
      "fe": 0.001099,
      "vo": 0.062389,
      "prob_pred": 0.004373062818518355,
      "bloom_event": null
    },
    {
      "time": "2024-12-01",
      "po4": 0.694784,
      "uo": -0.059172552078962326,
      "sst_anomaly": 0.9140005707740784,
      "nfai_pred": -0.4789135158061981,
      "nfai": null,
      "salinity": 36.082764,
      "fe": 0.001099,
      "vo": 0.062389,
      "prob_pred": 0.005217585760957855,
      "bloom_event": null
    },
    {
      "time": "2025-01-01",
      "po4": 0.694784,
      "uo": -0.05998070165514946,
      "sst_anomaly": 0.8531263470649719,
      "nfai_pred": -0.48198628425598145,
      "nfai": null,
      "salinity": 36.082764,
      "fe": 0.001099,
      "vo": 0.062389,
      "prob_pred": 0.004792737849772816,
      "bloom_event": null
    },
    {
      "time": "2025-02-01",
      "po4": 0.694784,
      "uo": -0.11574012041091919,
      "sst_anomaly": 0.7679232954978943,
      "nfai_pred": -0.4949501156806946,
      "nfai": null,
      "salinity": 36.082764,
      "fe": 0.001099,
      "vo": 0.062389,
      "prob_pred": 0.0009979729743276819,
      "bloom_event": null
    },
    {
      "time": "2025-03-01",
      "po4": 0.694784,
      "uo": -0.09598906338214874,
      "sst_anomaly": 0.8368790149688721,
      "nfai_pred": -0.49438828229904175,
      "nfai": null,
      "salinity": 36.082764,
      "fe": 0.001099,
      "vo": 0.062389,
      "prob_pred": 0.0018130216198216217,
      "bloom_event": null
    },
    {
      "time": "2025-04-01",
      "po4": 0.694784,
      "uo": -0.10269840061664581,
      "sst_anomaly": 0.3795284926891327,
      "nfai_pred": -0.5119883418083191,
      "nfai": null,
      "salinity": 36.082764,
      "fe": 0.001099,
      "vo": 0.062389,
      "prob_pred": 0.0009394980529173328,
      "bloom_event": null
    },
    {
      "time": "2025-05-01",
      "po4": 0.694784,
      "uo": -0.10624071955680847,
      "sst_anomaly": 0.2529454529285431,
      "nfai_pred": -0.48952770233154297,
      "nfai": null,
      "salinity": 36.082764,
      "fe": 0.001099,
      "vo": 0.062389,
      "prob_pred": 0.000748821512520259,
      "bloom_event": null
    },
    {
      "time": "2025-06-01",
      "po4": 0.694784,
      "uo": -0.1306784749031067,
      "sst_anomaly": -0.04549100622534752,
      "nfai_pred": -0.4631112813949585,
      "nfai": null,
      "salinity": 36.082764,
      "fe": 0.001099,
      "vo": 0.062389,
      "prob_pred": 0.00028591616302800954,
      "bloom_event": null
    },
    {
      "time": "2025-07-01",
      "po4": 0.694784,
      "uo": -0.09232330322265625,
      "sst_anomaly": 0.11668382585048676,
      "nfai_pred": -0.44434627890586853,
      "nfai": null,
      "salinity": 36.082764,
      "fe": 0.001099,
      "vo": 0.062389,
      "prob_pred": 0.0009397945546240487,
      "bloom_event": null
    },
    {
      "time": "2025-08-01",
      "po4": 0.694784,
      "uo": -0.052353765815496445,
      "sst_anomaly": 0.5090876221656799,
      "nfai_pred": -0.43215808272361755,
      "nfai": null,
      "salinity": 36.082764,
      "fe": 0.001099,
      "vo": 0.062389,
      "prob_pred": 0.004095241799555096,
      "bloom_event": null
    },
    {
      "time": "2025-09-01",
      "po4": 0.694784,
      "uo": 0.0032389757689088583,
      "sst_anomaly": 0.7036330103874207,
      "nfai_pred": -0.4506523311138153,
      "nfai": -0.4407886862754822,
      "salinity": 36.082764,
      "fe": 0.001099,
      "vo": 0.062389,
      "prob_pred": 0.021655083813966105,
      "bloom_event": 1
    },
    {
      "time": "2025-10-01",
      "po4": 0.694784,
      "uo": 0.017377277836203575,
      "sst_anomaly": 0.7858510613441467,
      "nfai_pred": -0.4709346294403076,
      "nfai": -0.4857552945613861,
      "salinity": 36.082764,
      "fe": 0.001099,
      "vo": 0.062389,
      "prob_pred": 0.033954002413015764,
      "bloom_event": 0
    },
    {
      "time": "2025-11-01",
      "po4": 0.694784,
      "uo": -0.13235002756118774,
      "sst_anomaly": 0.5215623378753662,
      "nfai_pred": -0.4918229281902313,
      "nfai": -0.4618454575538635,
      "salinity": 36.082764,
      "fe": 0.001099,
      "vo": 0.062389,
      "prob_pred": 0.0004956463149913613,
      "bloom_event": 1
    },
    {
      "time": "2025-12-01",
      "po4": 0.694784,
      "uo": -0.14016829431056976,
      "sst_anomaly": 0.6173244714736938,
      "nfai_pred": -0.4893069565296173,
      "nfai": -0.4571599066257477,
      "salinity": 36.082764,
      "fe": 0.001099,
      "vo": 0.062389,
      "prob_pred": 0.00044512412806095364,
      "bloom_event": 1
    },
    {
      "time": "2026-01-01",
      "po4": 0.694784,
      "uo": -0.12813463807106018,
      "sst_anomaly": 0.6928166747093201,
      "nfai_pred": -0.463439404964447,
      "nfai": -0.4729968011379242,
      "salinity": 36.082764,
      "fe": 0.001099,
      "vo": 0.062389,
      "prob_pred": 0.0006634805011083182,
      "bloom_event": 0
    },
    {
      "time": "2026-02-01",
      "po4": 0.694784,
      "uo": -0.060608476400375366,
      "sst_anomaly": 0.6594011187553406,
      "nfai_pred": -0.43057453632354736,
      "nfai": null,
      "salinity": 36.082764,
      "fe": 0.001099,
      "vo": 0.062389,
      "prob_pred": 0.003850199061533235,
      "bloom_event": null
    },
    {
      "time": "2026-07-01",
      "po4": 0.694784,
      "uo": 1.14663,
      "sst_anomaly": 0.2587,
      "salinity": 36.0828,
      "fe": 0.001099,
      "vo": 1.58425,
      "prob_pred": 1.0,
      "bloom_event": null
    }
  ],
  "playas_ref_date": "julio 2026"
}

documentacion_tesis_sargazo.md

### Expansión de Variables y Tratamiento de la Colinealidad

$$z = -2.5971 + 0.2104 \cdot \text{sst\_anom}_{\text{scaled}} + 2.1191 \cdot \text{salinidad}_{\text{scaled}} - 1.6533 \cdot \text{po4}_{\text{scaled}} + 0.4811 \cdot \text{fe}_{\text{scaled}} + 1.5275 \cdot \text{uo}_{\text{scaled}} + 0.3909 \cdot \text{vo}_{\text{scaled}}$$

Este nuevo enfoque probabilístico logró un rendimiento sobresaliente, alcanzando un **AUC-ROC de $0.901$** en la fase de validación, lo que demuestra una alta capacidad para discriminar días normales de verdaderos eventos de arribazón masiva.